{
  "schema_version": 1,
  "fact_set_id": "agentcore.api-surface",
  "tier": "A",
  "generator": "src/ingest/botocore-diff.ts",
  "verified_at": "2026-08-24T19:27:18.756Z",
  "source": {
    "kind": "botocore-model",
    "url": "pkg:pypi/botocore@1.43.3#botocore/data · bedrock-agentcore, bedrock-agentcore-control",
    "fetched_at": "2026-08-24T19:27:18.756Z",
    "content_hash": "sha256:dffdbc698f8c87c3e504c862f12b3f7c40810e392c60ae18f7f237dee86bc0d6",
    "retrieved_by": "gunzip + parse botocore/data/{bedrock-agentcore,bedrock-agentcore-control}/<api-version>/service-2.json.gz from botocore 1.43.3"
  },
  "evidence": {
    "canonical": {
      "bedrock-agentcore": {
        "uid": "bedrock-agentcore-2024-02-28",
        "apiVersion": "2024-02-28",
        "operationsFp": "sha256:6502f1a5e2fda44c5e4cb4962ddf4a3b75f1bdcc7bc0bf20653e4069b748543a",
        "schemaFp": "sha256:4e2713c1b07c96384188964789601c6a396d2dc48337e4fd87337077b3431a07",
        "operationCount": 54
      },
      "bedrock-agentcore-control": {
        "uid": "bedrock-agentcore-control-2023-06-05",
        "apiVersion": "2023-06-05",
        "operationsFp": "sha256:a9292e3e7ac271e2e8b9aacf6ab470e30ed2595f44fa22889284905e40c38147",
        "schemaFp": "sha256:a7225769cb99df4b2fb798f5ab9383401661d580769ee0ef51f9adeb93821e32",
        "operationCount": 115
      }
    },
    "text": "bedrock-agentcore (bedrock-agentcore-2024-02-28, api-version 2024-02-28) exposes 54 operations.\nbedrock-agentcore-control (bedrock-agentcore-control-2023-06-05, api-version 2023-06-05) exposes 115 operations."
  },
  "facts": {
    "agentcore.api-surface.bedrock-agentcore.operation-count": {
      "type": "integer",
      "value": 54,
      "note": "Operations in botocore model bedrock-agentcore-2024-02-28."
    },
    "agentcore.api-surface.bedrock-agentcore.operations-fingerprint": {
      "type": "string",
      "value": "sha256:6502f1a5e2fda44c5e4cb4962ddf4a3b75f1bdcc7bc0bf20653e4069b748543a",
      "note": "Sorted operation-name set. Changes on add/remove/rename only."
    },
    "agentcore.api-surface.bedrock-agentcore.schema-fingerprint": {
      "type": "string",
      "value": "sha256:4e2713c1b07c96384188964789601c6a396d2dc48337e4fd87337077b3431a07",
      "note": "Canonical input/output/error skeletons. Changes on parameter or shape edits; unaffected by documentation."
    },
    "agentcore.api-surface.bedrock-agentcore-control.operation-count": {
      "type": "integer",
      "value": 115,
      "note": "Operations in botocore model bedrock-agentcore-control-2023-06-05."
    },
    "agentcore.api-surface.bedrock-agentcore-control.operations-fingerprint": {
      "type": "string",
      "value": "sha256:a9292e3e7ac271e2e8b9aacf6ab470e30ed2595f44fa22889284905e40c38147",
      "note": "Sorted operation-name set. Changes on add/remove/rename only."
    },
    "agentcore.api-surface.bedrock-agentcore-control.schema-fingerprint": {
      "type": "string",
      "value": "sha256:a7225769cb99df4b2fb798f5ab9383401661d580769ee0ef51f9adeb93821e32",
      "note": "Canonical input/output/error skeletons. Changes on parameter or shape edits; unaffected by documentation."
    }
  },
  "previous": {
    "agentcore.api-surface.bedrock-agentcore.operation-count": 54,
    "agentcore.api-surface.bedrock-agentcore.operations-fingerprint": "sha256:6502f1a5e2fda44c5e4cb4962ddf4a3b75f1bdcc7bc0bf20653e4069b748543a",
    "agentcore.api-surface.bedrock-agentcore.schema-fingerprint": "sha256:4e2713c1b07c96384188964789601c6a396d2dc48337e4fd87337077b3431a07",
    "agentcore.api-surface.bedrock-agentcore-control.operation-count": 115,
    "agentcore.api-surface.bedrock-agentcore-control.operations-fingerprint": "sha256:a9292e3e7ac271e2e8b9aacf6ab470e30ed2595f44fa22889284905e40c38147",
    "agentcore.api-surface.bedrock-agentcore-control.schema-fingerprint": "sha256:a7225769cb99df4b2fb798f5ab9383401661d580769ee0ef51f9adeb93821e32"
  }
}
